{
    "run_id":  "phase9a-cross-run-local-queue-followup-review",
    "harness_version":  "0.2.0",
    "prompt_version":  "0.2.0",
    "artifact_dir":  "harness\\runs\\2026-06-23-phase-9a-cross-run-local-queue\\reviews\\phase9a-code-review-followup",
    "task_file":  "harness\\runs\\2026-06-23-phase-9a-cross-run-local-queue\\task.md",
    "plan_file":  "harness\\runs\\2026-06-23-phase-9a-cross-run-local-queue\\plan.md",
    "diff_file":  "harness\\runs\\2026-06-23-phase-9a-cross-run-local-queue\\reviews\\phase9a-code-review-followup\\diff.patch",
    "diff_meta_file":  "harness\\runs\\2026-06-23-phase-9a-cross-run-local-queue\\reviews\\phase9a-code-review-followup\\diff.meta.json",
    "changed_files_file":  "harness\\runs\\2026-06-23-phase-9a-cross-run-local-queue\\reviews\\phase9a-code-review-followup\\changed-files.txt",
    "verification_file":  "harness\\runs\\2026-06-23-phase-9a-cross-run-local-queue\\reviews\\phase9a-code-review-followup\\verification-summary.md",
    "review_scope":  [
                         "Verify Phase 9A review follow-up fixes",
                         "queue requeue precondition for run-local job status",
                         "already-terminal referenced job audit status",
                         "duplicate entry creation atomicity",
                         "remaining medium/high/critical risks only"
                     ],
    "output_file":  "harness\\runs\\2026-06-23-phase-9a-cross-run-local-queue\\reviews\\phase9a-code-review-followup\\claude-review.json",
    "review_file":  "harness\\runs\\2026-06-23-phase-9a-cross-run-local-queue\\reviews\\phase9a-code-review-followup\\claude-review.evidence.json",
    "raw_log_file":  "harness\\runs\\2026-06-23-phase-9a-cross-run-local-queue\\reviews\\phase9a-code-review-followup\\claude-review.raw.log",
    "timeout_seconds":  600,
    "max_input_chars":  180000,
    "max_files":  25,
    "max_diff_lines":  2500
}
