{
    "run_id":  "phase9a-cross-run-local-queue-stranding-followup-review",
    "harness_version":  "0.2.0",
    "prompt_version":  "0.2.0",
    "artifact_dir":  "harness\\runs\\2026-06-23-phase-9a-cross-run-local-queue\\reviews\\phase9a-code-review-stranding-followup",
    "task_file":  "harness\\runs\\2026-06-23-phase-9a-cross-run-local-queue\\task.md",
    "plan_file":  "harness\\runs\\2026-06-23-phase-9a-cross-run-local-queue\\plan.md",
    "diff_file":  "harness\\runs\\2026-06-23-phase-9a-cross-run-local-queue\\reviews\\phase9a-code-review-stranding-followup\\diff.patch",
    "diff_meta_file":  "harness\\runs\\2026-06-23-phase-9a-cross-run-local-queue\\reviews\\phase9a-code-review-stranding-followup\\diff.meta.json",
    "changed_files_file":  "harness\\runs\\2026-06-23-phase-9a-cross-run-local-queue\\reviews\\phase9a-code-review-stranding-followup\\changed-files.txt",
    "verification_file":  "harness\\runs\\2026-06-23-phase-9a-cross-run-local-queue\\reviews\\phase9a-code-review-stranding-followup\\verification-summary.md",
    "review_scope":  [
                         "Verify final Phase 9A stranding follow-up fix only",
                         "non-HarnessCliError referenced job claim/load exceptions must not strand queue claims",
                         "unexpected execution exceptions must not strand queue claims",
                         "medium/high/critical risks only"
                     ],
    "output_file":  "harness\\runs\\2026-06-23-phase-9a-cross-run-local-queue\\reviews\\phase9a-code-review-stranding-followup\\claude-review.json",
    "review_file":  "harness\\runs\\2026-06-23-phase-9a-cross-run-local-queue\\reviews\\phase9a-code-review-stranding-followup\\claude-review.evidence.json",
    "raw_log_file":  "harness\\runs\\2026-06-23-phase-9a-cross-run-local-queue\\reviews\\phase9a-code-review-stranding-followup\\claude-review.raw.log",
    "timeout_seconds":  600,
    "max_input_chars":  120000,
    "max_files":  10,
    "max_diff_lines":  1000
}
