{
    "run_id":  "phase6-scheduler-watch-code-review",
    "harness_version":  "0.2.0",
    "prompt_version":  "0.2.0",
    "artifact_dir":  "harness\\runs\\2026-06-22-phase-6-scheduler-watch-mode\\reviews\\phase6-code-review",
    "task_file":  "harness\\runs\\2026-06-22-phase-6-scheduler-watch-mode\\task.md",
    "plan_file":  "docs\\superpowers\\plans\\2026-06-22-phase-6-scheduler-background-worker-implementation.md",
    "diff_file":  "harness\\runs\\2026-06-22-phase-6-scheduler-watch-mode\\reviews\\phase6-code-review\\diff.patch",
    "diff_meta_file":  "harness\\runs\\2026-06-22-phase-6-scheduler-watch-mode\\reviews\\phase6-code-review\\diff.meta.json",
    "changed_files_file":  "harness\\runs\\2026-06-22-phase-6-scheduler-watch-mode\\reviews\\phase6-code-review\\changed-files.txt",
    "verification_file":  "harness\\runs\\2026-06-22-phase-6-scheduler-watch-mode\\reviews\\phase6-code-review\\verification-summary.md",
    "review_scope":  [
                         "Phase 6 scheduler watch/background-worker implementation correctness",
                         "scheduler lifecycle and stop semantics",
                         "state/evidence authority boundaries",
                         "CI/package smoke coverage",
                         "blocking regressions and high/critical risks"
                     ],
    "output_file":  "harness\\runs\\2026-06-22-phase-6-scheduler-watch-mode\\reviews\\phase6-code-review\\claude-review.json",
    "review_file":  "harness\\runs\\2026-06-22-phase-6-scheduler-watch-mode\\reviews\\phase6-code-review\\claude-review.evidence.json",
    "raw_log_file":  "harness\\runs\\2026-06-22-phase-6-scheduler-watch-mode\\reviews\\phase6-code-review\\claude-review.raw.log",
    "timeout_seconds":  600,
    "max_input_chars":  320000,
    "max_files":  40,
    "max_diff_lines":  5200
}
